{
  "schema_version": "1.0",
  "id": "TKT-0001",
  "decision_id": "DEC-001",
  "title": "The Wolfsberg questionnaire is not mandatory; a fallback question set is asked in Hazel onboarding",
  "target": {
    "repo": "react-frontend",
    "area": "step-03-documents"
  },
  "direction": "A bank that does not hold a Wolfsberg questionnaire is not blocked. It answers an equivalent set of questions inside the Hazel onboarding flow instead, and that data is pushed to CoverBase. The questions are asked by the Hazel-built onboarding rather than by CoverBase directly. A bank that does hold a Wolfsberg document continues on the existing path.",
  "reasoning": "Recorded as DEC-001 from the 2026-07-27 meeting, decided by Joel Olivares.",
  "acceptance_criteria": [
    "A spec change exists in react-frontend covering the behaviour in DEC-001, in the step-03-documents area.",
    "Every requirement added or modified by that change cites [DEC-001] in its requirement text.",
    "Each new or modified requirement has at least one scenario.",
    "The implementation satisfies the changed spec, and the PR references this issue."
  ],
  "evidence": [
    {
      "location": "t:0:16:02",
      "excerpt": "Yeah, I think that would be our best approach. Now, I can incorporate some of those questions into Cover Base, but I believe it's better if they come from the Hazel onboarding that the team is working on."
    },
    {
      "location": "t:0:27:38",
      "excerpt": "Right. Yeah. If they have a Wolfsberg, keep going. If they don't have a Wolfsberg, answer these questions."
    },
    {
      "location": "t:0:28:04",
      "excerpt": "I think Shawn is mentioning that \u2014 we will ask them, do you have that? And if not, then we'll ask those questions."
    }
  ],
  "authorized_by": {
    "librarian": "Shardul Patki",
    "authorized_at": "2026-08-03T17:55:31Z"
  },
  "status": "dispatched",
  "related_questions": [
    "Q-001"
  ],
  "dispatched_to": "https://github.com/shardulpatkitheorem/hop-frontend-demo/issues/1"
}
